{
  "schema": "pawmarvel-static-product-profile-v1",
  "product_profile_id": "unisex-tee-crewneck-hoodie-tanks",
  "preview": {"width": 1080, "height": 1430},
  "print_targets": [
    {"target_id": "3423x4533", "width": 3423, "height": 4533, "dpi": 300, "color_space": "sRGB", "background": "transparent"}
  ]
}
